{"interests": [{"id": "Airworthiness", "name": "Airworthiness"}, {"id": "Light aircraft", "name": "Light aircraft"}, {"id": "Licensing", "name": "Licensing"}], "overview": "<p>The CAA is conducting research into the experience of personnel licence holders across Flight Crew Licensing (commercial and private), Air Traffic Services and Aircraft Maintenance Licensing. The research will involve understanding customers' experience when it comes to updating, renewing and applying for licences, as well as exploring how the experience can be improved.</p>&#13;\n&#13;\n<p>By registering your interest, you are giving your consent to be contacted by our user research team regarding research opportunities that may be relevant to you between now and 2028.</p>&#13;\n&#13;\n<p><small>Information you provide in this form will be held and processed securely, in compliance with GDPR privacy policies. Specifically, we may use your contact information to invite you to arrange a research session and to provide further information about subsequent research activities relevant to you. Other information you supply below will be used to help us tailor our research so we ask you the most relevant questions. Our <a href=\"https://www.caa.co.uk/Our-work/About-us/General-privacy-notice/\">General privacy notice</a> includes more information about how we protect and store your data.</small></p>&#13;\n", "audiences": [{"id": "General Aviation", "name": "General Aviation"}, {"id": "Commercial airlines", "name": "Commercial airlines"}, {"id": "Air Navigation Service Providers", "name": "Air Navigation Service Providers"}, {"id": "Flightcrew", "name": "Flightcrew"}, {"id": "Air traffic control staff", "name": "Air traffic control staff"}, {"id": "FISO licence holders", "name": "FISO licence holders"}, {"id": "Airworthiness maintenance organisations", "name": "Airworthiness maintenance organisations"}], "contact_name": "", "id": "future-personnel-licencing-research-register", "startdate": "2024/08/30", "contact_jobtitle": "", "contact_team": "CAA research team", "title": "Register your interest in hearing about future research opportunities", "resultdate": "", "what_happens_next": null, "supporting_documents": [], "participate_url": "https://consultations.caa.co.uk/corporate-communications/future-personnel-licencing-research-register/consultation", "department": "Communications", "progress": "published", "type": "QuickConsult", "related_consultations": [], "status": "open", "type_string": "Online Survey", "workspace_id": "corporate-communications", "feedbackdate": "", "visibility": "public", "contact_email": "cx@caa.co.uk", "related_links": [], "why": null, "enddate": "2026/12/31", "url": "https://consultations.caa.co.uk/corporate-communications/future-personnel-licencing-research-register/consult_view", "contact_phone": "", "workspace_title": "Communications", "dept": "corporate-communications", "activity_type": "basic_survey"}